{
  "contract": "m1-combat-cases-v1",
  "status": "M1-258 candidate1: 번개 evolved만 발동 간격30→60틱으로 조정한 검토 가설. candidate9: 검토 전용 수치 가설. 진화는 미리 구성한 제안 상태이며 획득 진행이 아님. 설계 정본·출시 데이터 불변. 동일한30틱 사각걷기와 실제 피해·타격을 사용한다. 고리·포자 궤도600/700/900, evolved 충돌반경400·생성2600·회수4000은 세로 화면 안 접근과 반응을 관찰하기 위한 값이며 출시 밸런스가 아니다. Lv1 8사례만 적 상한24로 개별 타격 반응을 관찰한다. 단계별 수치 공정 비교가 아닌 공격 모양 검토 시나리오이며 게임 스폰·출시 규칙은 바꾸지 않는다.",
  "baselineSourceCommit": "5118e2c2a06f6449be672a77a64b61c9a349d69b",
  "cases": [
    {
      "id": "core:iron_blade",
      "designRef": "data/review/m1-weapon-combat-cases.json#core:iron_blade/lv1",
      "proposedContract": "m1-review-composition-v1",
      "stage": "lv1",
      "classification": "hypothesis",
      "gear": {
        "id": "core:iron_blade",
        "designRef": "data/review/m1-weapon-combat-cases.json#core:iron_blade/lv1",
        "kind": "Arc",
        "damage": 24,
        "range": 1600,
        "cooldownTicks": 30,
        "speed": 220,
        "count": 1,
        "lifetimeTicks": 120,
        "knockback": 0,
        "workTicks": 1,
        "workRadius": 1000,
        "rewardExperience": 15,
        "capacity": 8,
        "aim": "nearest-enemy"
      },
      "arena": {
        "enemyId": "core:raider",
        "spawnPeriodTicks": 2,
        "enemyCap": 24,
        "enemySpeed": 20,
        "enemyHealth": 100,
        "durationTicks": 600,
        "enemyDamage": 1,
        "suppressedUntilTick": 1000000,
        "baseExperience": 1000000,
        "spawnRadius": 1200,
        "recycleRadius": 3000,
        "enemyBodyWidth": 475
      }
    },
    {
      "id": "core:iron_blade",
      "designRef": "data/review/m1-weapon-combat-cases.json#core:iron_blade/max",
      "proposedContract": "m1-review-composition-v1",
      "stage": "max",
      "classification": "hypothesis",
      "gear": {
        "id": "core:iron_blade",
        "designRef": "data/review/m1-weapon-combat-cases.json#core:iron_blade/max",
        "kind": "Arc",
        "damage": 80,
        "range": 3200,
        "cooldownTicks": 24,
        "speed": 360,
        "count": 8,
        "lifetimeTicks": 120,
        "knockback": 0,
        "workTicks": 1,
        "workRadius": 1000,
        "rewardExperience": 15,
        "capacity": 8,
        "aim": "nearest-enemy"
      },
      "arena": {
        "enemyId": "core:raider",
        "spawnPeriodTicks": 2,
        "enemyCap": 400,
        "enemySpeed": 20,
        "enemyHealth": 100,
        "durationTicks": 600,
        "enemyDamage": 1,
        "suppressedUntilTick": 1000000,
        "baseExperience": 1000000,
        "spawnRadius": 1200,
        "recycleRadius": 3000,
        "enemyBodyWidth": 475
      }
    },
    {
      "id": "core:iron_blade",
      "designRef": "data/review/m1-weapon-combat-cases.json#core:iron_blade/evolved",
      "proposedContract": "m1-review-composition-v1",
      "stage": "evolved",
      "classification": "hypothesis",
      "gear": {
        "id": "core:iron_blade",
        "designRef": "data/review/m1-weapon-combat-cases.json#core:iron_blade/evolved",
        "kind": "Arc",
        "damage": 140,
        "range": 6000,
        "cooldownTicks": 30,
        "speed": 500,
        "count": 32,
        "lifetimeTicks": 120,
        "knockback": 0,
        "workTicks": 1,
        "workRadius": 1000,
        "rewardExperience": 15,
        "capacity": 8,
        "aim": "nearest-enemy"
      },
      "arena": {
        "enemyId": "core:raider",
        "spawnPeriodTicks": 2,
        "enemyCap": 400,
        "enemySpeed": 20,
        "enemyHealth": 100,
        "durationTicks": 600,
        "enemyDamage": 1,
        "suppressedUntilTick": 1000000,
        "baseExperience": 1000000,
        "spawnRadius": 1200,
        "recycleRadius": 3000,
        "enemyBodyWidth": 475
      }
    },
    {
      "id": "core:ward_orbit",
      "designRef": "data/review/m1-weapon-combat-cases.json#core:ward_orbit/lv1",
      "proposedContract": "m1-review-composition-v1",
      "stage": "lv1",
      "classification": "hypothesis",
      "gear": {
        "id": "core:ward_orbit",
        "designRef": "data/review/m1-weapon-combat-cases.json#core:ward_orbit/lv1",
        "kind": "Orbit",
        "damage": 24,
        "range": 600,
        "cooldownTicks": 30,
        "speed": 300,
        "count": 2,
        "lifetimeTicks": 120,
        "knockback": 0,
        "workTicks": 1,
        "workRadius": 1000,
        "rewardExperience": 15,
        "capacity": 8,
        "aim": "nearest-enemy"
      },
      "arena": {
        "enemyId": "core:raider",
        "spawnPeriodTicks": 2,
        "enemyCap": 24,
        "enemySpeed": 20,
        "enemyHealth": 100,
        "durationTicks": 600,
        "enemyDamage": 1,
        "suppressedUntilTick": 1000000,
        "baseExperience": 1000000,
        "spawnRadius": 1200,
        "recycleRadius": 3000,
        "enemyBodyWidth": 475
      }
    },
    {
      "id": "core:ward_orbit",
      "designRef": "data/review/m1-weapon-combat-cases.json#core:ward_orbit/max",
      "proposedContract": "m1-review-composition-v1",
      "stage": "max",
      "classification": "hypothesis",
      "gear": {
        "id": "core:ward_orbit",
        "designRef": "data/review/m1-weapon-combat-cases.json#core:ward_orbit/max",
        "kind": "Orbit",
        "damage": 80,
        "range": 700,
        "cooldownTicks": 24,
        "speed": 650,
        "count": 5,
        "lifetimeTicks": 120,
        "knockback": 0,
        "workTicks": 1,
        "workRadius": 1000,
        "rewardExperience": 15,
        "capacity": 8,
        "aim": "nearest-enemy"
      },
      "arena": {
        "enemyId": "core:raider",
        "spawnPeriodTicks": 2,
        "enemyCap": 400,
        "enemySpeed": 20,
        "enemyHealth": 100,
        "durationTicks": 600,
        "enemyDamage": 1,
        "suppressedUntilTick": 1000000,
        "baseExperience": 1000000,
        "spawnRadius": 1200,
        "recycleRadius": 3000,
        "enemyBodyWidth": 475
      }
    },
    {
      "id": "core:ward_orbit",
      "designRef": "data/review/m1-weapon-combat-cases.json#core:ward_orbit/evolved",
      "proposedContract": "m1-review-composition-v1",
      "stage": "evolved",
      "classification": "hypothesis",
      "gear": {
        "id": "core:ward_orbit",
        "designRef": "data/review/m1-weapon-combat-cases.json#core:ward_orbit/evolved",
        "kind": "Orbit",
        "damage": 140,
        "range": 900,
        "cooldownTicks": 30,
        "speed": 400,
        "count": 8,
        "lifetimeTicks": 120,
        "knockback": 0,
        "workTicks": 1,
        "workRadius": 1000,
        "rewardExperience": 15,
        "capacity": 8,
        "aim": "nearest-enemy"
      },
      "arena": {
        "enemyId": "core:raider",
        "spawnPeriodTicks": 2,
        "enemyCap": 400,
        "enemySpeed": 20,
        "enemyHealth": 100,
        "durationTicks": 600,
        "enemyDamage": 1,
        "suppressedUntilTick": 1000000,
        "baseExperience": 1000000,
        "spawnRadius": 2600,
        "recycleRadius": 4000,
        "enemyBodyWidth": 475
      }
    },
    {
      "id": "core:storm_fork",
      "designRef": "data/review/m1-weapon-combat-cases.json#core:storm_fork/lv1",
      "proposedContract": "m1-review-composition-v1",
      "stage": "lv1",
      "classification": "hypothesis",
      "gear": {
        "id": "core:storm_fork",
        "designRef": "data/review/m1-weapon-combat-cases.json#core:storm_fork/lv1",
        "kind": "Chain",
        "damage": 24,
        "range": 1600,
        "cooldownTicks": 30,
        "speed": 220,
        "count": 1,
        "lifetimeTicks": 120,
        "knockback": 0,
        "workTicks": 1,
        "workRadius": 1000,
        "rewardExperience": 15,
        "capacity": 8,
        "aim": "nearest-enemy"
      },
      "arena": {
        "enemyId": "core:raider",
        "spawnPeriodTicks": 2,
        "enemyCap": 24,
        "enemySpeed": 20,
        "enemyHealth": 100,
        "durationTicks": 600,
        "enemyDamage": 1,
        "suppressedUntilTick": 1000000,
        "baseExperience": 1000000,
        "spawnRadius": 1200,
        "recycleRadius": 3000,
        "enemyBodyWidth": 475
      }
    },
    {
      "id": "core:storm_fork",
      "designRef": "data/review/m1-weapon-combat-cases.json#core:storm_fork/max",
      "proposedContract": "m1-review-composition-v1",
      "stage": "max",
      "classification": "hypothesis",
      "gear": {
        "id": "core:storm_fork",
        "designRef": "data/review/m1-weapon-combat-cases.json#core:storm_fork/max",
        "kind": "Chain",
        "damage": 80,
        "range": 3200,
        "cooldownTicks": 24,
        "speed": 360,
        "count": 8,
        "lifetimeTicks": 120,
        "knockback": 0,
        "workTicks": 1,
        "workRadius": 1000,
        "rewardExperience": 15,
        "capacity": 8,
        "aim": "nearest-enemy"
      },
      "arena": {
        "enemyId": "core:raider",
        "spawnPeriodTicks": 2,
        "enemyCap": 400,
        "enemySpeed": 20,
        "enemyHealth": 100,
        "durationTicks": 600,
        "enemyDamage": 1,
        "suppressedUntilTick": 1000000,
        "baseExperience": 1000000,
        "spawnRadius": 1200,
        "recycleRadius": 3000,
        "enemyBodyWidth": 475
      }
    },
    {
      "id": "core:storm_fork",
      "designRef": "data/review/m1-weapon-combat-cases.json#core:storm_fork/evolved",
      "proposedContract": "m1-review-composition-v1",
      "stage": "evolved",
      "classification": "hypothesis",
      "gear": {
        "id": "core:storm_fork",
        "designRef": "data/review/m1-weapon-combat-cases.json#core:storm_fork/evolved",
        "kind": "Chain",
        "damage": 140,
        "range": 6000,
        "cooldownTicks": 60,
        "speed": 500,
        "count": 32,
        "lifetimeTicks": 120,
        "knockback": 0,
        "workTicks": 1,
        "workRadius": 1000,
        "rewardExperience": 15,